,date,username,geo,text,likes,retweets,hashtags
0,2019-09-19 19:13:27+00:00,gmanews_sports,,: Kevin Durant in Brooklyn jersey!https://twitter.com/brooklynnets/status/1174756850664951816 …,5,1,
0,2019-09-19 11:41:05+00:00,gmanews_sports,,Gilas Pilipinas out of FIBA Olympic Qualifying Tournamenthttp://bit.ly/2lVCPM7,22,7,
0,2019-09-19 09:02:12+00:00,gmanews_sports,,Changes in schedule for basketball games on Sept. 29 | via @uaap_officialhttps://twitter.com/uaap_official/status/1174605188100845568 …,3,0,
0,2019-09-19 05:54:25+00:00,gmanews_sports,,Kevin Belingon should be wary of Bibiano Fernandes' grappling and right hand — Mark Sangiaohttp://bit.ly/2kR8TjO,0,0,
0,2019-09-19 02:04:54+00:00,gmanews_sports,,Veteran boxing promoter Bob Arum believes Manny Pacquiao should retire from the sport soon unless he can land a lucrative rematch with Floyd Mayweather.http://bit.ly/2kIsG5d,25,3,
0,2019-09-18 23:46:01+00:00,gmanews_sports,,"Golden State Warriors guard Stephen Curry says he expects to play for the United States at next year's Tokyo Olympics, telling ESPN: ""That is the plan, for sure.""http://bit.ly/2knRVJF",6,0,
0,2019-09-18 13:35:16+00:00,gmanews_sports,,NU coach Jamike Jarin still proud of team despite 4 straight losseshttp://bit.ly/2knA05U,4,1,
0,2019-09-18 11:03:22+00:00,gmanews_sports,,NU's Jamike Jarin still proud despite four straight heartbreaking losseshttp://bit.ly/2m0fVmw,5,0,
0,2019-09-18 10:52:52+00:00,gmanews_sports,,"UAAP: UST falls to Adamson in fourth quarter meltdown, 78-71http://bit.ly/2mmGjYa",2,0,
0,2019-09-18 07:12:49+00:00,gmanews_sports,,"JUST IN: UST Growling Tigers fall to Adamson in fourth quarter meltdown, 78-71. | via @jk_carandang",5,1,
0,2019-09-18 07:10:12+00:00,gmanews_sports,,Adamson ceasefire. 24.2 ticks. | via @jk_carandang,1,0,
0,2019-09-18 07:03:55+00:00,gmanews_sports,,"Jerick Ahanmisi brings Adamson to 74, UST 71, 39.3 seconds left in Q4. | via @jk_carandang",14,3,
0,2019-09-18 06:50:45+00:00,gmanews_sports,,"Timeout Adamson, 68-59, UST. 4:57 in Q4. | via @jk_carandang",3,1,
0,2019-09-18 06:39:32+00:00,gmanews_sports,,End of Q3: UST 58-48 Adamson | via @jk_carandang,11,2,
0,2019-09-18 06:09:56+00:00,gmanews_sports,,"At the half, UST 38-33 AdU. #UAAPSeason82 | via @jk_carandangpic.twitter.com/PlX7pvZWQl",14,3,#UAAPSeason82
0,2019-09-18 05:58:37+00:00,gmanews_sports,,NU coach Jamike Jarin still proud of their team despite fourth heartbreaking loss. | via @jk_carandangpic.twitter.com/0UY2ei21A0,48,5,
0,2019-09-18 05:44:50+00:00,gmanews_sports,,"The UP Fighting Maroons survived a late run from the NU Bulldogs to notch their third win, 80-79, Wednesday at the Mall of Asia Arena.http://bit.ly/2krZu2c",1,0,
0,2019-09-18 05:40:51+00:00,gmanews_sports,,End of Q1: Adamson 19-15 UST #UAAPSeason82 | via @jk_carandang,9,2,#UAAPSeason82
0,2019-09-18 05:15:45+00:00,gmanews_sports,,Kobe Paras shares his thoughts after the win over NU | @jk_carandangpic.twitter.com/nm3NuFSfN4,116,16,
0,2019-09-18 05:15:14+00:00,gmanews_sports,,UP coach Bo Perasol says they need to learn how to close out games as a team. | @jk_carandangpic.twitter.com/3BSk4Ybx95,29,2,
0,2019-09-18 05:05:11+00:00,gmanews_sports,,"Kobe Paras topped in scoring for the Maroons with 25 pts, while Akhuetie delivered another double-double, 19p, 12r. Dave Ildefonso also had 25 pts. Issa Gaye registered 13p, 13r. | @jk_carandangpic.twitter.com/Ic7RWp5FpZ",87,15,
0,2019-09-18 04:55:17+00:00,gmanews_sports,,"JUST IN: UP escapes NU, 80-79. #UAAPSeason82 | @jk_carandang",32,4,#UAAPSeason82
0,2019-09-17 12:35:00+00:00,gmanews_sports,,FIBA flag now in PHL for 2023 World Cuphttp://bit.ly/2lVsuQ7,61,8,
0,2019-09-17 04:19:47+00:00,gmanews_sports,,"Michael Jordan, other NBA owners in tequila venturehttp://bit.ly/2mjDPtx",5,0,
0,2019-09-17 00:02:11+00:00,gmanews_sports,,"Magic retain options on Bamba, Fultz, Isaachttp://bit.ly/2kPgDTo",5,0,
0,2019-09-15 14:53:49+00:00,gmanews_sports,,Gasol claims rare NBA-World Cup double as Spain beat Argentina #FIBAWChttp://bit.ly/2kiiSOW,20,2,#FIBAWChttp
0,2019-09-15 14:17:05+00:00,gmanews_sports,,#FIBAWC All-Star 5! Bogdanovic ( @LeaderOfHorde) @EvanFourmizz @ruuufio @MarcGasol @LScola4 | via @FIBAWCpic.twitter.com/BSU5sJHadZ,30,6,#FIBAWC
0,2019-09-15 13:57:51+00:00,gmanews_sports,,"JUST IN: Spain is crowned FIBA World Cup Champions after beating Argentina in the Finals, 95-75. #FIBAWC | via @mavgonzales (Photo: FIBA website)pic.twitter.com/cf9MqmVZ4h",98,19,#FIBAWC
0,2019-09-15 13:27:43+00:00,gmanews_sports,,"Spain still ahead of Argentina, 66-47, at the end of the third. One quarter left in the FIBA World Cup Finals. #FIBAWC | @mavgonzales",2,0,#FIBAWC
0,2019-09-15 12:44:47+00:00,gmanews_sports,,"At the end of the first half, Spain enjoys a huge lead over Argentina at the FIBA World Cup Finals, 43-31. | @mavgonzales",12,2,
0,2019-09-15 12:12:31+00:00,gmanews_sports,,"Kobe Paras makes 20 as UP overcomes Adamson in OT, 83-82 #UAAPSeason82http://bit.ly/2kKlBRm",97,10,#UAAPSeason82http
0,2019-09-15 11:21:03+00:00,gmanews_sports,,"FINAL: UP overcomes Adamson in OT, 83-82. #UAAPSeason82 (Photo: UAAP)pic.twitter.com/RjEnRyCKds",221,29,#UAAPSeason82
0,2019-09-15 11:19:00+00:00,gmanews_sports,,"Bright Akhuetie 2/2 from the line, UP 83-82 Adamson. 2.8 secs left in OT. #UAAPSeason82",9,1,#UAAPSeason82
0,2019-09-15 10:59:21+00:00,gmanews_sports,,Another overtime! UP and Adamson locked in at 73 at the end of regulation. #UAAPSeason82,42,2,#UAAPSeason82
0,2019-09-15 10:57:39+00:00,gmanews_sports,,Javi GDL triple ties the game at 73. 17.5 seconds left in Q4. #UAAPSeason82,5,1,#UAAPSeason82
0,2019-09-15 10:24:21+00:00,gmanews_sports,,End of Q3: AdU 50-52 UP #UAAPSeason82,2,0,#UAAPSeason82
0,2019-09-15 09:47:50+00:00,gmanews_sports,,At the half: Adamson 41-25 UP #UAAPSeason82,2,0,#UAAPSeason82
0,2019-09-15 09:15:23+00:00,gmanews_sports,,End of Q1: Adamson 20-18 UP #UAAPSeason82,2,0,#UAAPSeason82
0,2019-09-15 08:25:54+00:00,gmanews_sports,,"FINAL: UST Growling Tigers tame NU Bulldogs in Overtime, 87-74. #UAAPSeason82 (Photo: UAAP)pic.twitter.com/RYSYJ0413H",177,23,#UAAPSeason82
0,2019-09-15 08:12:08+00:00,gmanews_sports,,We are going into overtime! NU and UST locked at 70! #UAAPSeason82,3,0,#UAAPSeason82
0,2019-09-15 08:05:03+00:00,gmanews_sports,,"Abando three, NU timeout. UST 67-68 NU, 27 secs left, Q4. #UAAPSeason82",3,0,#UAAPSeason82
0,2019-09-14 15:48:03+00:00,gmanews_sports,,#UAAPSeason82: UE's Suerte adjusted easily to the UAAPhttp://bit.ly/2kkFZbK,2,0,#UAAPSeason82
0,2019-09-14 12:26:25+00:00,gmanews_sports,,#UAAPSeason82: Ateneo routs FEU to keep record cleanhttp://bit.ly/2kJpXIz,19,3,#UAAPSeason82
0,2019-09-14 10:08:24+00:00,gmanews_sports,,"#UAAPSeason82: Rey Suerte lists 31, sinks back-to-back clutch threes to lead UE's first winhttp://bit.ly/2khehfU",45,6,#UAAPSeason82
0,2019-09-14 00:12:27+00:00,gmanews_sports,,"Tyson Fury, Deontay Wilder agree to terms of rematch, third fight-reporthttp://bit.ly/2lTyjxm",0,0,
0,2019-09-13 14:54:57+00:00,gmanews_sports,,Age-defying Scola leads Argentina over France to finals vs. Spain #FIBAWC http://bit.ly/2kz0AJA pic.twitter.com/PJbQ0XkMbn,34,4,#FIBAWC
0,2019-09-13 14:04:44+00:00,gmanews_sports,,Argentina goes to the Finals! #FIBAWChttps://twitter.com/FIBAWC/status/1172511107325382656 …,5,0,#FIBAWChttps
0,2019-09-13 12:55:08+00:00,gmanews_sports,,Go Hard Girls: New podcast puts spotlight on Pinay athleteshttp://bit.ly/2kKFrvP,6,1,
0,2019-09-13 12:00:52+00:00,gmanews_sports,,"Marc Gasol pushes Spain past Australia, into FIBA World Cup finalshttp://bit.ly/2lU0f48",20,4,
0,2019-09-13 10:57:36+00:00,gmanews_sports,,Spain advances to the Finals! #FIBAWChttps://twitter.com/FIBAWC/status/1172458113665916929 …,6,0,#FIBAWChttps
0,2019-09-12 02:31:58+00:00,gmanews_sports,,LeBron James backs bill to let college athletes earn endorsement moneyhttp://bit.ly/2kgjfcX,7,1,
0,2019-09-11 13:29:09+00:00,gmanews_sports,,FIBA WORLD CUP: France eliminates USA in major upsethttp://bit.ly/2kEjlv1,10,0,
0,2019-09-11 11:30:00+00:00,gmanews_sports,,"Yeng Guiao, kumalas sa Gilas Pilipinas matapos mabokya ang koponan sa FIBA World Cuphttp://bit.ly/2lLEQKz",9,2,
0,2019-09-11 09:46:29+00:00,gmanews_sports,,UAAP: La Salle escapes late NU run to notch first winhttp://bit.ly/2mbOFli,15,1,
0,2019-09-11 08:26:14+00:00,gmanews_sports,,Nets' Durant: 'Some days I hate the circus of the NBA'http://bit.ly/2kF3L2i,5,0,
0,2019-09-11 08:14:02+00:00,gmanews_sports,,Michael Jordan pledges $1M to Hurricane Dorian relief in Bahamashttp://bit.ly/2krpCKB,8,0,
0,2019-09-11 07:59:55+00:00,gmanews_sports,,Guiao quits Gilas Pilipinas after winless FIBA World Cup stinthttp://bit.ly/2m8YbWd,103,15,
0,2019-09-11 07:50:57+00:00,gmanews_sports,,JUST IN: Coach Yeng Guiao steps down as head coach of Gilas Pilipinas basketball team | via @officialSBPincpic.twitter.com/YTQnbXmeRr,96,20,
0,2019-09-10 04:11:00+00:00,gmanews_sports,,Orphan goes from sniffing glue to playing for the PHL rugby teamhttp://bit.ly/2k6Ko1K,2,0,
0,2019-09-10 03:47:26+00:00,gmanews_sports,,Grizzlies reportedly won’t buy out Iguodalahttp://bit.ly/2m82Ibx,11,2,
0,2019-09-09 10:31:48+00:00,gmanews_sports,,Douthit wants SMB import McCullough as next Gilas Pilipinas naturalized playerhttp://bit.ly/2m4P8Wh,5,0,
0,2019-09-08 13:57:10+00:00,gmanews_sports,,"JUST IN: Gilas Pilipinas falls to Iran, 95-75, to end its #FIBAWC stint.pic.twitter.com/23x0PNyuOO",7,0,#FIBAWC
0,2019-09-08 13:04:29+00:00,gmanews_sports,,"At the half, Iran with the lead against Gilas Pilipinas in the classification round, 48-34. #LabanPilipinas #FIBAWCpic.twitter.com/5vQ47ngksY",4,0,#LabanPilipinas #FIBAWCpic
0,2019-09-08 10:39:18+00:00,gmanews_sports,,Stats for DLSU vs ADMUpic.twitter.com/HpcKGsphgm,7,0,
0,2019-09-08 10:26:44+00:00,gmanews_sports,,Coach Tab Baldwin shares his thoughts on the win against La Salle.pic.twitter.com/I2vFivn8Cd,70,10,
0,2019-09-08 10:07:23+00:00,gmanews_sports,,"JUST IN: Ateneo dominates La Salle to get win number two, 81-69. (Photo: UAAP)pic.twitter.com/5JvTiiHu3l",16,4,
0,2019-09-08 10:00:06+00:00,gmanews_sports,,"La Salle timeout. 1:41 left in Q4. Ateneo, 77-67.",0,0,
0,2019-09-08 09:52:27+00:00,gmanews_sports,,Ateneo calls for time after La Salle run. Ateneo 71-62 La Salle: 4:50 Q4. #UAAPSeason82,1,0,#UAAPSeason82
0,2019-09-08 09:44:21+00:00,gmanews_sports,,"La Salle calls for ceasefire. 70-52, Ateneo. 9:02 in Q4.",1,0,
0,2019-09-08 09:40:44+00:00,gmanews_sports,,Andrade triple brings Ateneo to 66. La Salle 50. End of Q3. #UAAPSeason82,3,1,#UAAPSeason82
0,2019-09-08 09:19:51+00:00,gmanews_sports,,Halftime stats: La Salle FGs 12/39. Malonzo leads in scoring with 11. Ateneo FGs 17/42. Nieto bros with combined 23 points. #UAAPSeason82pic.twitter.com/Yd8m9yfgtz,3,0,#UAAPSeason82pic
0,2019-09-08 09:03:23+00:00,gmanews_sports,,"Domination for Ateneo at the second period to end the first half, 51-29. #UAAPSeason82",6,0,#UAAPSeason82
0,2019-09-08 08:56:17+00:00,gmanews_sports,,"Navarro sinks two from the stripe. Ateneo 40-29 La Salle, 2:27 in Q2. La Salle timeout.",3,0,
0,2019-09-08 08:51:21+00:00,gmanews_sports,,"Ateneo widens the gap, 38-29, 3:54, Q2. #UAAPSeason82",5,0,#UAAPSeason82
0,2019-09-08 08:41:22+00:00,gmanews_sports,,La Salle calls for time. Ateneo 28-25 La Salle: 7:05 in Q2.,1,0,
0,2019-09-08 08:34:53+00:00,gmanews_sports,,"Encho Serrano shot brings La Salle to 21 to end the first quarter. Ateneo, 23. #UAAPSeason82",1,0,#UAAPSeason82
0,2019-09-08 08:25:08+00:00,gmanews_sports,,"DLSU 12-17 ADMU, 4:57 in Q1.",3,0,
0,2019-09-08 08:14:54+00:00,gmanews_sports,,It’s on! Ateneo vs La Salle first round face-off! #UAAPSeason82pic.twitter.com/TjcmnmTzAh,29,2,#UAAPSeason82pic
0,2019-09-08 06:21:07+00:00,gmanews_sports,,"FEU Tamaraws notch their first win at UE's expense, 81-65. (Photo: UAAP)pic.twitter.com/OUNW5zJRD8",53,7,
0,2019-09-07 12:35:05+00:00,gmanews_sports,,#UAAPSeason82: Mark Nonoy tows UST to victory over UPhttp://bit.ly/2k2LpI8,63,8,#UAAPSeason82
0,2019-09-07 11:28:45+00:00,gmanews_sports,,#UAAPSeason82: Clutch Douanga triple delivers win for Adamson in thriller OThttp://bit.ly/2lE28Cd,27,3,#UAAPSeason82
0,2019-09-07 10:53:38+00:00,gmanews_sports,,UST fans cheer after the win!pic.twitter.com/3acJ0M1nH5,23,2,
0,2019-09-07 10:48:30+00:00,gmanews_sports,,"JUST IN: UST Growling Tigers defeat the UP Fighting Maroons, 85-69. (Photo: UAAP)pic.twitter.com/vjYzZAhMXP",259,34,
0,2019-09-07 08:24:03+00:00,gmanews_sports,,"JUST IN: Lenda Douanga triple delivers the win for Adamson Falcons against NU Bulldogs in OT, 84-83. (Photo: UAAP) #UAAPSeason82pic.twitter.com/0kjoyIHd2v",205,30,#UAAPSeason82pic
0,2019-09-07 08:04:22+00:00,gmanews_sports,,(Photo: UAAP),0,0,
0,2019-09-07 08:04:01+00:00,gmanews_sports,,We’re going to overtime. Adamson and NU end regulation at 74-all. #UAAP82pic.twitter.com/qFK9c9huWH,2,0,#UAAP82pic
0,2019-09-07 03:55:00+00:00,gmanews_sports,,"Rafa Nadal moved to the brink of a 19th career Grand Slam title on Friday by beating Matteo Berrettini 7-6(6), 6-4, 6-1 to reach the US Open final.http://bit.ly/2lYWwSZ",36,7,
0,2019-09-07 02:55:38+00:00,gmanews_sports,,"Love him or hate him, Daniil Medvedev will play for a first Grand Slam title after grinding out a 7-6(5), 6-4, 6-3 win over Grigor Dimitrov at the US Open on Friday.http://bit.ly/2lJ7RX9",12,1,
0,2019-09-06 14:11:03+00:00,gmanews_sports,,#FIBAWC: Gilas Pilipinas failed to qualify for the #Tokyo2020 Olympics as China beat Korea in the classification phase of the FIBA World Cup on Friday.http://bit.ly/2kyn11c,9,2,#FIBAWC #Tokyo2020
0,2019-09-06 13:38:26+00:00,gmanews_sports,,#FIBAWC: Gilas Pilipinas falls to Tunisiahttp://bit.ly/2k2CjLt,1,0,#FIBAWC
0,2019-09-06 13:34:47+00:00,gmanews_sports,,"FINAL: Gilas Pilipinas falls to Tunisia in #FIBAWC classification round, 86-67.pic.twitter.com/nOb3WI3qvH",32,6,#FIBAWC
0,2019-09-06 12:40:39+00:00,gmanews_sports,,"At the half: Tunisia with the lead against Gilas, 46-24. #FIBAWCpic.twitter.com/dOJl6BNoBf",17,2,#FIBAWCpic
0,2019-09-06 12:20:07+00:00,gmanews_sports,,"End of Q1: Tunisia 27 - 10 Gilas Pilipinas, in the #FIBAWC Classification roundpic.twitter.com/Ya2p2WyrXB",14,2,#FIBAWC
0,2019-09-06 11:31:39+00:00,gmanews_sports,,"The victory improved Iran's chances of directly qualifying for the 2020 Tokyo Olympics, putting pressure on Gilas Pilipinas to win their game against Tunisia later at 8 pm. #FIBAWChttp://bit.ly/2m3jsRf",15,2,#FIBAWChttp
0,2019-09-06 07:14:13+00:00,gmanews_sports,,Andreescu KOs Bencic to set up blockbuster final with Serenahttp://bit.ly/2m2RrJz,1,0,
0,2019-09-06 01:34:18+00:00,gmanews_sports,,Williams dismantles Svitolina to reach US Open finalhttp://bit.ly/2kvrNN6,21,2,
0,2019-09-05 02:04:42+00:00,gmanews_sports,,Gilas Pilipinas is now headed to Beijing for the classification phase of the FIBA World Cup.http://bit.ly/2lSxJjs,80,5,
0,2019-09-04 14:49:24+00:00,gmanews_sports,,FIBA WORLD CUP: Ravena fights back tears after Gilas Pilipinas' overtime loss to Angolahttp://bit.ly/2kuhSXY,2,0,
0,2019-09-04 13:30:57+00:00,gmanews_sports,,"CJ Perez 'incredible' despite late lapse in Angola loss, says Gilas Pilipinas coach Yeng Guiaohttp://bit.ly/2jYXbDn",10,1,
0,2019-09-04 12:24:39+00:00,gmanews_sports,,UAAP SEASON 82: Ateneo opens title defense with win against Adamsonhttp://bit.ly/2lxXXaS,16,2,
0,2019-09-04 10:14:02+00:00,gmanews_sports,,"JUST IN: Ateneo Blue Eagles open title defense with win against Adamson Soaring Falcons, 70-52. (Photo: UAAP) | via @jk_carandangpic.twitter.com/hNhdDQw7P7",49,7,
0,2019-09-04 09:45:38+00:00,gmanews_sports,,"Gilas Pilipinas ends the group stage with a loss against Angola in overtime, 84 - 81 #FIBAWCpic.twitter.com/pIwHEZArip",77,13,#FIBAWCpic
0,2019-09-04 09:25:35+00:00,gmanews_sports,,We’re going to overtime! #FIBAWC #LabanPilipinaspic.twitter.com/S39oc2oqqD,50,10,#FIBAWC #LabanPilipinaspic
0,2019-09-04 09:15:14+00:00,gmanews_sports,,Halftime Stat sheet for Ateneo vs Adamson | via @jk_carandangpic.twitter.com/6hi8VeHryN,3,0,
0,2019-09-04 09:01:09+00:00,gmanews_sports,,"UP notches first win, Javi GDL lists 22http://bit.ly/2k3CFBK",52,9,
0,2019-09-04 07:09:27+00:00,gmanews_sports,,UAAP: Abando leads UST for the win to open UAAP Season 82http://bit.ly/2kh4rLc,3,0,
0,2019-09-04 07:04:55+00:00,gmanews_sports,,"JUST IN: UP Fighting Maroons open their campaign with a win over FEU Tamaraws, 61-55. | Photos: UAAP @jk_carandangpic.twitter.com/4t9aE4NUkZ",9,0,
0,2019-09-04 03:08:12+00:00,gmanews_sports,,CJ Perez answers questions from the press (Part 2) | @marspanaligan On playing against NBA players and thoughts going into the game against Angola this afternoon #FIBAWC #LabanPilipinas @gmanewspic.twitter.com/5EgO6aS0Wm,11,3,#FIBAWC #LabanPilipinas
0,2019-09-04 03:00:36+00:00,gmanews_sports,,"CJ Perez answers questions from the press (Part 1) | @marspanaligan On being Gilas’ consistent “silver lining”, on praises he received from fans #FIBAWC #LabanPilipinas @gmanewspic.twitter.com/QLijUlwsHR",15,2,#FIBAWC #LabanPilipinas
0,2019-09-04 02:54:59+00:00,gmanews_sports,,Junemar Fajardo answers questions from the press (Part 2) | @marspanaligan On playing against Boban Marjanovic and how playing against bigger men will help improve his game. #FIBAWC #LabanPilipinas @gmanewspic.twitter.com/xEVRk7kn8u,6,2,#FIBAWC #LabanPilipinas
0,2019-09-04 02:52:50+00:00,gmanews_sports,,Filipino pole vaulter Ernest John Obiena has become the first Filipino to qualify for the 2020 Tokyo Summer Olympic Games.http://bit.ly/2keiukF,6,1,
0,2019-09-04 02:50:12+00:00,gmanews_sports,,"Junemar Fajardo answers questions from the press (Part 1) | @marspanaligan On playing against Jokic, on the mood of the team after their loss against Serbia, and what they will need to do for their game vs Angola later. #FIBAWC #LabanPilipinas @gmanewspic.twitter.com/M7OPoejXV7",5,4,#FIBAWC #LabanPilipinas
0,2019-09-04 02:33:23+00:00,gmanews_sports,,CJ Perez is not aware of Filipino fans back home singing him praises after his brilliant performances against Italy and Serbia at the FIBA World Cup.http://bit.ly/2lRgoHF,7,0,
0,2019-09-04 02:25:39+00:00,gmanews_sports,,The first Filipino to qualify for the #Tokyo2020 olympics is Ernest John Obiena!https://twitter.com/psc_gov/status/1169067904689569792 …,232,45,#Tokyo2020
0,2019-09-04 02:04:28+00:00,gmanews_sports,,‘Ruthless’ Serena Williams grabs 100th US Open win as record title nearshttp://bit.ly/2krn1jG,1,0,
0,2019-09-04 01:07:12+00:00,gmanews_sports,,"After two bad losses against Serbia and Italy, Gilas Pilipinas wants to make it up to their fans with a victory against Angola at the FIBA World Cup.http://bit.ly/2luiAVB",10,1,
0,2019-09-03 16:00:54+00:00,gmanews_sports,,"Turkey failed to extend a 92-91 lead by missing four consecutive free throws prior to the clutch shots by Middleton, who led Team USA with 15 points. #FIBAWChttp://bit.ly/2kpDZ1K",15,5,#FIBAWChttp
0,2019-09-03 15:53:30+00:00,gmanews_sports,,"“Nakakatuwa. Dati napapanood mo lang TV tapos ngayon nakalaro mo na di ba,” Fajardo said. “Sobrang liit lang pala ng mundo.” #FIBAWC #LabanPilipinashttp://bit.ly/2k0kQDB",55,5,#FIBAWC #LabanPilipinashttp
0,2019-09-03 14:52:35+00:00,gmanews_sports,,"Team USA wins over Turkey in overtime, 93-92. (Photo: FIBA website) #FIBAWCpic.twitter.com/flapqL8UVr",39,4,#FIBAWCpic
0,2019-09-03 14:33:32+00:00,gmanews_sports,,Overtime! USA and Turkey tied at 81 at end of regulation in #FIBAWC.pic.twitter.com/S6vdIBgku2,65,8,#FIBAWC
0,2019-09-03 11:38:39+00:00,gmanews_sports,,FIBA WORLD CUP: Serbia coach believes Gilas Pilipinas ‘missing some quality’http://bit.ly/2jZPcGj,26,3,
0,2019-09-03 09:05:00+00:00,gmanews_sports,,FIBA WORLD CUP: Gilas needs to ‘lift up spirits’ ahead of game vs. Angola — Guiaohttp://bit.ly/2jU7wjW,9,1,
0,2019-09-03 06:51:55+00:00,gmanews_sports,,FIBA WORLD CUP Yeng Guiao predicts toss-up fight between Serbia and Italyhttp://bit.ly/2lAUY1h,3,0,
0,2019-09-03 06:20:00+00:00,gmanews_sports,,FIBA WORLD CUP Angola coach expects close game vs Gilas Pilipinashttp://bit.ly/2lvdjNv,6,0,
0,2019-09-03 06:00:00+00:00,gmanews_sports,,Relentless Rafa knocks Cilic out of US Openhttp://bit.ly/2lz8Jxs,4,0,
0,2019-09-03 05:52:04+00:00,gmanews_sports,,FIBA WORLD CUP Yeng Guiao not surprised with CJ Perez’s brilliant performancehttp://bit.ly/2lyw5Ug,7,0,
0,2019-09-03 00:12:45+00:00,gmanews_sports,,"A record 54 players from the National Basketball Association are on the squads of national teams at this month's FIBA Basketball World Cup in China, up from 45 in the 2014 edition.http://bit.ly/2ls8415",6,0,
0,2019-09-02 13:38:35+00:00,gmanews_sports,,"JUST IN: Gilas falls to Serbia, 126-67, bows out of #FIBAWC contention. #FIBAWC #LabanPilipinas Read for details: http://bit.ly/2ltegWs pic.twitter.com/tUXfMi8wDW",4,0,#FIBAWC #FIBAWC #LabanPilipinas
0,2019-09-02 13:34:09+00:00,gmanews_sports,,Top performers Gilas: CJ Perez Serbia: Bogdan Bogdanovic #FIBAWC #LabanPilipinas (From FIBA site)pic.twitter.com/qm5EMxaNVC,154,21,#FIBAWC #LabanPilipinas
0,2019-09-02 13:31:41+00:00,gmanews_sports,,"Full time stats for PHI vs SRB: Gilas: 25/67 FGs, 3/24 3-pts made, 23 rebs Serbia: 48/64 FGs, 12/22 3-pts made, 37 rebs #FIBAWC #LabanPilipinaspic.twitter.com/C3SM3smfJh",12,3,#FIBAWC #LabanPilipinaspic
0,2019-09-02 13:22:44+00:00,gmanews_sports,,"JUST IN: Gilas Pilipinas bows out of contention in the #FIBAWC after falling against Serbia, 126-67.http://bit.ly/2ltegWs",42,2,#FIBAWC
0,2019-09-02 13:18:34+00:00,gmanews_sports,,"JUST IN: Gilas falls to Serbia, 126-67. #FIBAWC #LabanPilipinaspic.twitter.com/njbRCGNXoX",92,20,#FIBAWC #LabanPilipinaspic
0,2019-09-02 13:15:07+00:00,gmanews_sports,,"Lee sinks 2/2 from the stripe. SRB 121-67 PHI, 1:06 #FIBAWC #LabanPilipinas",6,1,#FIBAWC #LabanPilipinas
0,2019-09-02 12:19:18+00:00,gmanews_sports,,"At the half, Serbia with the lead against Gilas, 62-35. #FIBAWC #LabanPilipinas (From FIBA website)pic.twitter.com/lcgOzcgGd7",18,8,#FIBAWC #LabanPilipinas
0,2019-09-02 11:55:23+00:00,gmanews_sports,,"End of Q1: Serbia up against Gilas, 28-13. #FIBAWC #LabanPilipinaspic.twitter.com/OJz1xqsX2n",11,4,#FIBAWC #LabanPilipinaspic
0,2019-09-02 11:46:51+00:00,gmanews_sports,,"Timeout, Gilas. Serbia with the lead, 21-11, 2:24 in Q1. #LabanPilipinas #FIBAWC",2,1,#LabanPilipinas #FIBAWC
0,2019-09-02 11:43:40+00:00,gmanews_sports,,"Kiefer sinks 2/2 from the stripe,. 16-11, Serbia, 3:38. #LabanPilipinas #FIBAWC",9,1,#LabanPilipinas #FIBAWC
0,2019-09-02 11:37:09+00:00,gmanews_sports,,"Paul Lee gives the lead to Gilas. PHI up, 9-7, 6:02. #LabanPilipinas #FIBAWC",15,1,#LabanPilipinas #FIBAWC
0,2019-09-02 11:29:15+00:00,gmanews_sports,,Starters for Gilas vs Serbia: Andray Blatche Paul Lee Gabe Norwood Troy Rosario Japeth Aguilar #LabanPilipinas #PilipinasGotGame,35,6,#LabanPilipinas #PilipinasGotGame
0,2019-09-02 10:33:17+00:00,gmanews_sports,,FIBA WORLD CUP: French basketball star Rudy Gobert hits out after dope testhttp://bit.ly/2lx5bMw,4,0,
0,2019-09-02 07:39:19+00:00,gmanews_sports,,"Unable to sleep after Italy nightmare, Gilas vows to do better vs. Serbiahttp://bit.ly/2kljbsk",59,7,
0,2019-09-02 05:59:49+00:00,gmanews_sports,,Djokovic's US Open title defense derailed by injuryhttp://bit.ly/2jVi8ze,2,0,
0,2019-09-01 16:01:35+00:00,gmanews_sports,,Donovan Mitchell scored 16 points and Harrison Barnes added 14 to lead Team USA to an 88-67 win over the Czech Republic. #FIBAWChttp://bit.ly/2NIFu7v,1,1,#FIBAWChttp
0,2019-09-01 14:35:00+00:00,gmanews_sports,,"Serbia keen to avoid upset vs Gilas Pilipinas, says coach #FIBAWC #LabanPilipinas #PilipinasGotGamehttp://bit.ly/2PzKGNx",0,0,#FIBAWC #LabanPilipinas #PilipinasGotGamehttp
0,2019-09-01 13:01:00+00:00,gmanews_sports,,#UAAPSeason82 coaches answer: Who is the team to beat this season?http://bit.ly/2UlrMZy,3,0,#UAAPSeason82
0,2019-09-01 12:31:00+00:00,gmanews_sports,,"#UAAPSeason82 a banner year for the league, says UAAP Presidenthttp://bit.ly/30L0gqO",6,1,#UAAPSeason82
0,2019-09-01 12:01:00+00:00,gmanews_sports,,#FIBAWC Andray Blatche 'takes 100% responsibility' for Gilas loss to Italyhttp://bit.ly/2Zv0OVh,1,0,#FIBAWC
0,2019-09-01 11:40:19+00:00,gmanews_sports,,Let the games begin! #UAAPSeason82http://bit.ly/2ZEl4TB,9,0,#UAAPSeason82http
0,2019-09-01 05:48:02+00:00,gmanews_sports,,"WATCH: UST coach Aldin Ayo: Nine of our 16 players are newcomers, but not necessarily rookies. Medyo kulang sa exposure but sama lumabas ang laro nila sa season. | via @jk_carandangpic.twitter.com/DBhrCK6A0B",5,0,
0,2019-09-01 05:47:44+00:00,gmanews_sports,,WATCH: UP coach Bo Perasol: Expectations for us are in place. We hope we can live up to the expectations thrown at us. | via @jk_carandangpic.twitter.com/4cDSzkU0eL,0,0,
0,2019-09-01 05:21:24+00:00,gmanews_sports,,WATCH: FEU coach Olsen Racela says fans will see a different FEU team since half of their roster are rookies. | via @jk_carandangpic.twitter.com/pRoBfIwVkC,3,0,
0,2019-09-01 05:20:55+00:00,gmanews_sports,,WATCH: DLSU coach Gian Nazario: We’re all excited for the season. | via @jk_carandangpic.twitter.com/VDNIu1IPZd,2,0,
0,2019-09-01 04:50:23+00:00,gmanews_sports,,"#IMReady: Isa nang ganap na bagyo ang low pressure area sa silangan ng Hinatuan, Surigao del Sur, ayon sa @dost_pagasa. #LiwaywayPHpic.twitter.com/bYs5EJkQer",0,0,#IMReady #LiwaywayPHpic
0,2019-09-01 04:43:39+00:00,gmanews_sports,,"LOOK: Ateneo’s Emmanuel Fernandez says Season 82 is a banner year for the league because of UAAP athletes playing in the upcoming SEA Games: All for more is not just playing for your team, but also for country. | via @jk_carandangpic.twitter.com/9H8ybBYuFs",4,1,
0,2019-08-31 15:08:52+00:00,gmanews_sports,,Coach Yeng shares his thoughts on their next game against Serbia | @marspanaligan #FIBAWC #LabanPilipinas #PilipinasGotGamepic.twitter.com/4FryF8opW8,2,0,#FIBAWC #LabanPilipinas #PilipinasGotGamepic
