,date,username,geo,text,likes,retweets,hashtags
0,2019-04-28 10:37:13+00:00,gmanews_sports,,"Playoff for number 2 spot to be played on Wednesday. Meanwhile, women's volleyball Final Four games will be played next weekend: May 4 (Saturday): Ateneo* vs FEU May 5 (Sunday): La Salle vs UST *with twice-to-beat advantage",40,7,
0,2019-04-28 10:32:35+00:00,gmanews_sports,,"With FEU's win, La Salle will play UST in a virtual best-of-three series. DLSU and UST will have a playoff for the twice to beat advantage, then face each other again in the Final Four.",49,2,
0,2019-04-28 10:27:51+00:00,gmanews_sports,,"The FEU Lady Tamaraws topple the DLSU Lady Spikers in five sets, 25-22, 13-25, 15-25, 27-25, 15-8. #UAAPSeason81Volleyball",136,18,#UAAPSeason81Volleyball
0,2019-04-28 07:48:28+00:00,gmanews_sports,,"Ateneo Lady Eagles end the elimination round with a 12-2 record after sweeping the UE Lady Warriors, 25-20, 27-25, 25-11. #UAAPSeason81Volleyball",53,2,#UAAPSeason81Volleyball
0,2019-04-28 06:28:09+00:00,gmanews_sports,,"#AndStill Nonito Donaire retains his WBA Bantamweight Super Champion belt after knocking out his opponent Stephon Young in the sixth round of their match in Lafayette, Louisiana, USA.http://bit.ly/2L9d1s2",1,0,#AndStill
0,2019-04-28 05:41:46+00:00,gmanews_sports,,"The Nuggets advance to the next round of the #NBAPlayoffs after surviving a late run by the Spurs in Game 7 of their series, 90-86. Nikola Jokic -- 21 pts, 15 rebs, 10 assists Jamal Murray -- 23 pointshttp://bit.ly/2GOkSqC",5,1,#NBAPlayoffs
0,2019-04-28 04:35:35+00:00,gmanews_sports,,Denver advances to the next round!https://twitter.com/nuggets/status/1122358546044084224 …,2,0,
0,2019-04-28 03:24:00+00:00,gmanews_sports,,. @warriors backcourt stars Stephen Curry and Klay Thompson are questionable for Sunday's Western Conference semifinals opener against the @HoustonRockets due to injured right ankles. #NBAPlayoffshttp://bit.ly/2UKkME7,11,2,#NBAPlayoffshttp
0,2019-04-28 02:54:00+00:00,gmanews_sports,,Former ONE flyweight world champion Geje Eustaquio is set to make his return inside the cage when he takes on South Korea's Kim Kyu Sung on the undercard of ONE: Enter the Dragon on May 17 at the Singapore Indoor Stadium.http://bit.ly/2GCNMIT,8,1,
0,2019-04-28 02:18:08+00:00,gmanews_sports,,"#UAAPSeason81Volleyball team ranking and player rankings per skill as of April 27, 2019.pic.twitter.com/K3NF43R2Sw",78,27,#UAAPSeason81Volleyball
0,2019-04-27 13:01:00+00:00,gmanews_sports,,This is the first time that DLSU retired a jersey of an athlete from a non-team sport.http://bit.ly/2XP6Omq,93,11,
0,2019-04-27 11:57:01+00:00,gmanews_sports,,"The Adamson Lady Falcons ended their season on a winning note with their victory against the UP Lady Maroons in straight sets, 25-20, 25-23, 25-19. #UAAPSeason81Volleyball",6,1,#UAAPSeason81Volleyball
0,2019-04-27 11:57:01+00:00,gmanews_sports,,"EARLIER: The UST Golden Tigresses secure at least a twice-to-beat playoff after winning over the NU Lady Bulldogs in four sets, 27-25, 25-17, 20-25, 25-16. #UAAPSeason81Volleyball",5,1,#UAAPSeason81Volleyball
0,2019-04-27 04:52:15+00:00,gmanews_sports,,Warriors advance!https://twitter.com/warriors/status/1121997953806168064 …,8,1,
0,2019-04-26 13:12:55+00:00,gmanews_sports,,"Rain or Shine forces do-or-die Game 7 against Magnolia in #PBA2019 semis, 91-81. (Photos: PBA Media Group)pic.twitter.com/5aJwNfmPPy",39,4,#PBA2019
0,2019-04-26 05:06:08+00:00,gmanews_sports,,Spurs pull away from Nuggets to force Game 7http://bit.ly/2L0MxZr,4,0,
0,2019-04-26 05:05:01+00:00,gmanews_sports,,"John Havlicek, a Basketball Hall of Fame guard who played won eight championships with the Boston Celtics, died Thursday at age 79.http://bit.ly/2W5zFlW",29,5,
0,2019-04-26 02:55:08+00:00,gmanews_sports,,Game 7 on the way!https://twitter.com/spurs/status/1121602040600436736 …,2,0,
0,2019-04-26 02:25:29+00:00,gmanews_sports,,The Los Angeles Clippers are hoping to infuse some payback when they return home to take on the Golden State Warriors in Game 6 of their Western Conference first-round series on Friday night.http://bit.ly/2ZCzxga,25,5,
0,2019-04-26 02:22:58+00:00,gmanews_sports,,Tottenham have rediscovered the winning feeling just as their top-four rivals have faltered and victory against West Ham on Saturday would be a huge step towards qualifying for next season's Champions League.http://bit.ly/2UVkC1H,0,0,
0,2019-04-25 13:20:30+00:00,gmanews_sports,,"SMB will advance to the Philippine Cup Finals once again! The Beermen defeated Phoenix in Game 5 of the #PBA2019 Semis, 105-94. (Photos: PBA Media Group)pic.twitter.com/7qTBee1scg",62,17,#PBA2019
0,2019-04-25 06:15:43+00:00,gmanews_sports,,"Williams, Clippers top Warriors to stay alivehttp://bit.ly/2GEb56h",0,0,
0,2019-04-25 04:20:42+00:00,gmanews_sports,,"#UAAPSeason81Volleyball team standings and player rankings by skills as of April 24, 2019.pic.twitter.com/mSjaR6scGX",7,0,#UAAPSeason81Volleyball
0,2019-04-25 04:09:20+00:00,gmanews_sports,,Rockets move on after shutting down Jazzhttp://bit.ly/2vnDw1S,1,0,
0,2019-04-25 03:26:47+00:00,gmanews_sports,,Luke Walton’s lawyer rips accuser’s press conferencehttp://bit.ly/2ZuFkUJ,0,0,
0,2019-04-24 13:27:09+00:00,gmanews_sports,,"Magnolia takes 3-2 series lead with win over Rain or Shine in Game 5 of #PBA2019 semis, 82-74. (Photos: PBA Media Group)pic.twitter.com/lpafz1PaYB",65,14,#PBA2019
0,2019-04-24 09:57:46+00:00,gmanews_sports,,"Ateneo Lady Eagles secure twice-to-beat advantage after defeating Adamson Lady Falcons, 25-16, 28-26, 25-17. #UAAPSeason81Volleyball",5,1,#UAAPSeason81Volleyball
0,2019-04-24 07:38:34+00:00,gmanews_sports,,"DLSU Lady Spikers sweep the UE Lady Warriors, 25-17, 25-16, 25-19. #UAAPSeason81Volleyball",9,1,#UAAPSeason81Volleyball
0,2019-04-24 07:10:52+00:00,gmanews_sports,,Damian Lillard capped a 50-point game by sinking a long 3-pointer as time expired to give the Portland Trail Blazers a 118-115 victory over the visiting Oklahoma City Thunder on Tuesday night and a five-game series win.http://bit.ly/2XEIN1u,2,0,
0,2019-04-24 05:51:27+00:00,gmanews_sports,,Dame time! Portland advances!https://twitter.com/NBA/status/1120917215761530880 …,3,1,
0,2019-04-24 04:57:40+00:00,gmanews_sports,,"Jamal Murray had 23 points and seven assists, and the host Denver Nuggets beat the San Antonio Spurs 108-90 on Thursday night in Game 5 of their Western Conference playoff series.http://bit.ly/2KVRGCd",0,0,
0,2019-04-24 04:05:32+00:00,gmanews_sports,,"Joel Embiid collected 23 points and 13 rebounds as the Philadelphia 76ers cruised to a wire-to-wire, 122-100 victory over the visiting Brooklyn Nets on Tuesday and closed out their Eastern Conference first-round playoff series in five games.http://bit.ly/2DtGRBe",0,0,
0,2019-04-24 03:07:12+00:00,gmanews_sports,,Kawhi Leonard scored 27 points as the Toronto Raptors powered into the NBA Eastern Conference playoff semifinals with a 115-96 demolition of the Orlando Magic on Tuesday.http://bit.ly/2ZtlcSS,0,0,
0,2019-04-24 03:00:57+00:00,gmanews_sports,,Sixers advance!https://twitter.com/sixers/status/1120884295210610688 …,1,0,
0,2019-04-24 03:00:17+00:00,gmanews_sports,,Raptors advance!!https://twitter.com/Raptors/status/1120864098168782853 …,1,0,
0,2019-04-23 13:45:40+00:00,gmanews_sports,,"SMB now with a 3-1 series lead after beating Phoenix in Game 4 of #PBA2019 semis, 114-91. (Photos: PBA Media Group)pic.twitter.com/BjN1x25T0S",49,8,#PBA2019
0,2019-04-23 09:16:46+00:00,gmanews_sports,,NBA: Mitchell powers Jazz to Game 4 win over Rocketshttp://bit.ly/2ZrThCX,9,1,
0,2019-04-23 06:00:14+00:00,gmanews_sports,,Jazz wins over Rockets!https://twitter.com/utahjazz/status/1120555157014503424 …,1,0,
0,2019-04-23 04:00:03+00:00,gmanews_sports,,Milwaukee advances!https://twitter.com/Bucks/status/1120519177142456321 …,8,0,
0,2019-04-23 03:54:02+00:00,gmanews_sports,,"New Sacramento Kings coach Luke Walton is being sued for an alleged sexual assault by Los Angeles-based sports reporter Kelli Tennant, according to a report by TMZ Sports on Monday.http://bit.ly/2vhTCuf",4,0,
0,2019-04-23 03:53:20+00:00,gmanews_sports,,"Giannis Antetokounmpo poured in 41 points, and the visiting Milwaukee Bucks earned their first playoff series victory in 18 seasons by completing a four-game sweep of the Detroit Pistons with a 127-104 win on Monday.http://bit.ly/2KW7vc7",2,1,
0,2019-04-22 04:21:25+00:00,gmanews_sports,,Blazers win!https://twitter.com/trailblazers/status/1120176319684386816 …,1,0,
0,2019-04-22 04:20:02+00:00,gmanews_sports,,Congratulations! https://twitter.com/psc_gov/status/1120173799263965186 …,21,1,
0,2019-04-22 02:23:06+00:00,gmanews_sports,,3-1 for the North!https://twitter.com/Raptors/status/1120137196797870080 …,0,0,
0,2019-04-22 02:22:32+00:00,gmanews_sports,,3-1 for Golden State!https://twitter.com/warriors/status/1120087485936128000 …,2,0,
0,2019-04-22 02:22:01+00:00,gmanews_sports,,Celtics advance to the next round!https://twitter.com/celtics/status/1120050118345072641 …,3,0,
0,2019-04-21 13:14:32+00:00,gmanews_sports,,"JUST IN: Phoenix Fuelmasters take Game 3 against San Miguel Beermen, 92-90. SMB leads series, 2-1. #PBA2019 (Photos: PBA Media Group)pic.twitter.com/1DZ9vyLU9g",2,0,#PBA2019
0,2019-04-21 08:31:00+00:00,gmanews_sports,,Terence Crawford makes Amir Khan quit in sixhttp://bit.ly/2IyyKY0,1,0,
0,2019-04-21 04:24:22+00:00,gmanews_sports,,Bucks go 3-0!https://twitter.com/Bucks/status/1119792170284797953 …,1,0,
0,2019-04-21 04:23:47+00:00,gmanews_sports,,Nuggets equalize!https://twitter.com/nuggets/status/1119753371144134656 …,0,0,
0,2019-04-21 04:23:02+00:00,gmanews_sports,,3-1 for the Sixers!https://twitter.com/sixers/status/1119720821520576512 …,0,0,
0,2019-04-20 05:34:00+00:00,gmanews_sports,,76ers' Embiid doubtful for Game 4 due to knee injuryhttp://bit.ly/2IsjbRG,1,0,
0,2019-04-20 05:24:00+00:00,gmanews_sports,,"When Kevin Durant rained down shots on the Los Angeles Clippers with his deadly playoff performance on Thursday, he also provided a glimpse of what life will be like for Golden State and their competition without the injured DeMarcus Cousins.http://bit.ly/2Gtdi39",4,1,
0,2019-04-20 05:02:05+00:00,gmanews_sports,,The Detroit Pistons couldn't beat Milwaukee when they had Blake Griffin in the lineup for all four regular-season meetings.http://bit.ly/2Gx16jd,3,0,
0,2019-04-20 04:29:14+00:00,gmanews_sports,,3-0 for the Celtics!https://twitter.com/celtics/status/1119435771205832704 …,6,0,
0,2019-04-20 04:28:28+00:00,gmanews_sports,,It’s okay for OKC!https://twitter.com/okcthunder/status/1119454202324029440 …,2,0,
0,2019-04-20 03:11:23+00:00,gmanews_sports,,"Riding defense, Rockets look for 3-0 lead at Jazzhttp://bit.ly/2IKedzh",1,1,
0,2019-04-20 02:34:28+00:00,gmanews_sports,,"Congratulations, Philippine Women’s Ice Hockey team!https://twitter.com/psc_gov/status/1119426864932462593 …",26,2,
0,2019-04-20 02:31:21+00:00,gmanews_sports,,2-1 for the Raptors!https://twitter.com/Raptors/status/1119415218776547330 …,4,0,
0,2019-04-20 02:29:05+00:00,gmanews_sports,,https://twitter.com/FIBA3x3/status/1119289776912388098 …,3,1,
0,2019-04-19 05:35:00+00:00,gmanews_sports,,Dubs win!https://twitter.com/warriors/status/1119108632224731146 …,6,2,
0,2019-04-19 05:06:51+00:00,gmanews_sports,,Two teams made it!https://twitter.com/FIBA3x3/status/1118943562069159937 …,5,2,
0,2019-04-19 05:00:08+00:00,gmanews_sports,,"but Congrats, Sixers!https://twitter.com/sixers/status/1119068463815974912 …",2,0,
0,2019-04-19 04:58:18+00:00,gmanews_sports,,2-1 for the Spurs!https://twitter.com/spurs/status/1119080051205656576 …,2,0,
0,2019-04-17 04:15:51+00:00,gmanews_sports,,Murray’s big fourth lifts Nuggets past Spurs to even serieshttp://bit.ly/2PdzVwA,1,0,
0,2019-04-17 03:58:55+00:00,gmanews_sports,,"Kawhi Leonard scored 37 points on 15-for-22 shooting from the field, and the Toronto Raptors defeated the visiting Orlando Magic 111-82 Tuesday night to even their first-round Eastern Conference playoff series at one game apiece.http://bit.ly/2Zk9QR0",0,0,
0,2019-04-17 00:37:14+00:00,gmanews_sports,,"Golden State center DeMarcus Cousins suffered a torn left quad muscle and is out indefinitely, the team said Tuesday afternoon.http://bit.ly/2UmONd5",1,0,
0,2019-04-16 14:50:48+00:00,gmanews_sports,,"Magnolia wins over Rain or Shine in Game 3 of #PBA2019 Semis, 85-74. RoS leads series, 2-1. (Photos: PBA Media Group)pic.twitter.com/wyFGRyy2tr",44,7,#PBA2019
0,2019-04-16 09:46:40+00:00,gmanews_sports,,Cignal Ateneo with a very big win over McDavid in the PBA D-League!https://twitter.com/PBA_DLeague/status/1118072819529596928 …,6,0,
0,2019-04-16 03:50:53+00:00,gmanews_sports,,Luke Walton is officially the new coach of the Sacramento Kings.http://bit.ly/2Xe0OTR,20,2,
0,2019-04-16 03:39:47+00:00,gmanews_sports,,"The Philadelphia 76ers seized control in a 51-point third quarter, set a team record for points in a quarter and a playoff game, and evened their first-round series at one game apiece with a 145-123 victory over the visiting Brooklyn Nets on Monday night.http://bit.ly/2UBnJvH",2,0,
0,2019-04-16 00:59:24+00:00,gmanews_sports,,"Hours before the defending NBA champion Golden State Warriors were to face the Los Angeles Clippers in Game 2 of their first-round playoff series Monday, forward Kevin Durant apologized for his ejection in the Saturday's Game 1 opener.http://bit.ly/2VKIx08",3,1,
0,2019-04-15 13:34:48+00:00,gmanews_sports,,"SMB takes the series lead (2-0) after winning over Phoenix, 92-82. #PBA2019 (Photos: PBA Media Group)pic.twitter.com/my4id4simO",51,9,#PBA2019
0,2019-04-14 16:18:02+00:00,gmanews_sports,,"Team rankings and player rankings by skills as of April 14, 2019. #UAAPSeason81Volleyballpic.twitter.com/cnYRzOqjxZ",66,17,#UAAPSeason81Volleyballpic
0,2019-04-14 12:45:32+00:00,gmanews_sports,,"Rain or Shine dominates over Magnolia in Game 2 of #PBASemis, 93-80. Elastopainters now up in the series, 2-0. (Photos: PBA Media Group)pic.twitter.com/ufn9nXE6zk",39,13,#PBASemis
0,2019-04-14 10:40:02+00:00,gmanews_sports,,"UAAP Season 81 Women's Volleyball Final Four and standings as of April 14, 2019: Ateneo Lady Eagles (10-2) DLSU Lady Spikers (9-3) UST Golden Tigresses (9-4) FEU Lady Tamaraws (8-5)",175,40,
0,2019-04-14 10:37:01+00:00,gmanews_sports,,"UST Golden Tigresses defeat FEU Lady Tamaraws in straight sets, 25-23, 25-18, 25-23. UST now at solo third with 9-4, while FEU at fourth spot with 8-5. #UAAPSeason81Volleyball",51,3,#UAAPSeason81Volleyball
0,2019-04-14 08:36:47+00:00,gmanews_sports,,"NU Lady Bulldogs eliminate the UP Lady Maroons from Final Four contention, 25-21, 26-24, 17-25, 23-25, 17-15. #UAAPSeason81Volleyball | via @tj_roxas",59,9,#UAAPSeason81Volleyball
0,2019-04-14 02:35:43+00:00,gmanews_sports,,"KD making his own record, too!https://twitter.com/WarriorsPR/status/1117235540363890690 …",0,0,
0,2019-04-14 02:34:50+00:00,gmanews_sports,,"Congratulations, Steph! #NBAPlayoffshttps://twitter.com/warriors/status/1117253940448333829 …",6,0,#NBAPlayoffshttps
0,2019-04-14 02:30:13+00:00,gmanews_sports,,"#UAAPSeason81Volleyball team rankings and player rankings by skills as of April 13, 2019.pic.twitter.com/UykJfPbaaJ",8,4,#UAAPSeason81Volleyball
0,2019-04-13 14:16:00+00:00,gmanews_sports,,"UAAP 81 VOLLEYBALL: La Salle sweeps Ateneo, books ticket to Final Fourhttp://bit.ly/2UOHXRW",85,11,
0,2019-04-13 13:38:47+00:00,gmanews_sports,,"SMB gets Game 1 of #PBA2019 semis against Phoenix, 100-88. (Photos: PBA Media Group)pic.twitter.com/WME8Nt0jf2",7,0,#PBA2019
0,2019-04-13 10:06:43+00:00,gmanews_sports,,"RDJ on Jolina dela Cruz’s performance: Sa practice naman, ganun si Jolina. Alam naman namin na kaya niyang gawin ‘yun. | via @jk_carandangpic.twitter.com/Wud2dzkN1V",129,10,
0,2019-04-13 10:01:07+00:00,gmanews_sports,,"DLSU head coach Ramil de Jesus on La Salle’s win: Hindi ko in-expect na ganitong kabilis matatapos ang game. Naglaro nang maayos ang mga bata today, kaya mukhang mas gusto nila manalo. | via @jk_carandangpic.twitter.com/MhyZpLKEmW",167,24,
0,2019-04-13 09:58:07+00:00,gmanews_sports,,Stats: DLSU’s Jolina dela Cruz led the Lady Spikers with 14 points. | via @jk_carandangpic.twitter.com/tnHDJWptas,30,4,
0,2019-04-13 09:42:42+00:00,gmanews_sports,,La Salle now holds 9-3 record while Ateneo has 10 wins and 2 losses. Watch the sequence that gave the win to DLSU | via @jk_carandangpic.twitter.com/SzM3y4xxPr,160,32,
0,2019-04-13 09:41:16+00:00,gmanews_sports,,"With the straight set win against rivals Ateneo, the defending champs clinch a Final Four berth. | via @jk_carandangpic.twitter.com/4AfKqkizBO",69,13,
0,2019-04-13 09:40:44+00:00,gmanews_sports,,La Salle now holds 9-3 record while Ateneo has 10 wins and 2 losses. Watch the sequence that gave the win to DLSU | via @jk_carandangpic.twitter.com/SzM3y4xxPr,14,3,
0,2019-04-13 09:36:50+00:00,gmanews_sports,,"JUST IN: DLSU Lady Spikers complete elimination round sweep of Ateneo Lady Eagles in straight sets 25-17, 25-13, 25-23. | via @jk_carandangpic.twitter.com/NSbOZ61jxe",170,28,
0,2019-04-13 09:29:23+00:00,gmanews_sports,,"La Salle calls for time as Ateneo inches closer in Set 3, 22-19 | via @jk_carandang",11,2,
0,2019-04-13 09:11:06+00:00,gmanews_sports,,"La Salle with the advantage, 8-5, heading into Set 3’s first technical timeout | via @jk_carandang",7,1,
0,2019-04-13 09:00:58+00:00,gmanews_sports,,"La Salle dominates Set 2, 25-13. Lady Spikers lead the game, 2-0. | via @jk_carandang",18,1,
0,2019-04-13 08:40:37+00:00,gmanews_sports,,"DLSU leads as they head to the first TTO of Set 2, 8-3. #UAAPSeason81Volleyball via @jk_carandang",15,2,#UAAPSeason81Volleyball
0,2019-04-13 08:39:42+00:00,gmanews_sports,,"DLSU Lady Spikers take Set 1, 25-17. #UAAPSeason81Volleyball | via @jk_carandangpic.twitter.com/C0YwJBO11o",23,2,#UAAPSeason81Volleyball
0,2019-04-13 08:08:38+00:00,gmanews_sports,,Ateneo and La Salle fans now coming in as the second round face-off the defending champs La Salle and league leader Ateneo will happen in a bit. #UAAPSeason81Volleyball via @jk_carandangpic.twitter.com/Eqk4LN9OkG,39,4,#UAAPSeason81Volleyball
0,2019-04-13 07:50:15+00:00,gmanews_sports,,Stats: UE’s Mendrez topped the Warriors with 15 points. | via @jk_carandangpic.twitter.com/fjdxqdzRLn,14,2,
0,2019-04-13 07:45:48+00:00,gmanews_sports,,"UE Lady Warriors defeat Adamson Lady Falcons in straight sets, 25-14, 25-19, 25-22 #UAAPSeason81Volleyball via @jk_carandangpic.twitter.com/iNqG1YVirq",64,4,#UAAPSeason81Volleyball
0,2019-04-12 15:18:51+00:00,gmanews_sports,,Edward Kelly back to winning ways with second round TKO of Sung Jong Leehttp://bit.ly/2IgyVY5,17,2,
0,2019-04-12 13:23:56+00:00,gmanews_sports,,"Rain or Shine draws first blood against Magnolia in #PBA2019 semis, 84-77. (Photos: PBA Media Group)pic.twitter.com/oBT8BSh4ez",7,1,#PBA2019
0,2019-04-12 01:15:51+00:00,gmanews_sports,,Team Lakay's redemption starts with Joshua Pacio says Mark Sangiaohttp://bit.ly/2Das6TI,2,1,
0,2019-04-12 01:14:44+00:00,gmanews_sports,,"Grizzlies fire coach, demote general managerhttp://bit.ly/2GhW6ic",0,0,
0,2019-04-11 23:47:08+00:00,gmanews_sports,,Larry Drew will not return for a second season as the head coach of the Cleveland Cavaliers after he and the team mutually agreed Thursday to part ways.http://bit.ly/2Z5X1di,2,0,
0,2019-04-11 14:56:16+00:00,gmanews_sports,,What do you think will be the Lakers' next move?http://bit.ly/2uZCyZz,1,1,
0,2019-04-11 14:54:20+00:00,gmanews_sports,,#TimeOut: Isang bagong yugto sa kanyang career sa boxing ang haharapin ngayon ng four-time world champion na si Brian Viloria.http://bit.ly/2KvGmwj,0,0,#TimeOut
0,2019-04-11 06:22:05+00:00,gmanews_sports,,All set! Who’s your pick? #NBAPlayoffshttps://twitter.com/NBA/status/1116215485887078400 …,5,0,#NBAPlayoffshttps
0,2019-04-10 14:59:27+00:00,gmanews_sports,,"Team rankings and player rankings by skills as of April 10, 2019 #UAAPSeason81Volleyballpic.twitter.com/9A6KxL3NhD",43,13,#UAAPSeason81Volleyballpic
0,2019-04-10 13:18:45+00:00,gmanews_sports,,"Magnolia eliminates Barangay Ginebra to advance to the semis, 85-72. The Hotshots will face Rain or Shine in the semis. (Photos: PBA Media Group) #PBA2019pic.twitter.com/tmbuMknktB",99,25,#PBA2019pic
0,2019-04-10 10:40:41+00:00,gmanews_sports,,"SMB makes it to the semis after beating TNT in their do-or-die game, 96-86. The Beermen will face Phoenix in the semis. #PBA2019 (Photos: PBA Media Group)pic.twitter.com/7Gnzqez5CZ",64,11,#PBA2019
0,2019-04-10 09:44:03+00:00,gmanews_sports,,"UST Golden Tigresses sweep the UP Lady Maroons, 25-21, 25-12, 26-24, for their 8th win and strengthen its bid to return to the Final Four. #UAAPSeason81Volleyball | @tj_roxas",24,2,#UAAPSeason81Volleyball
0,2019-04-10 09:41:44+00:00,gmanews_sports,,"UST Golden Tigresses defeat UP Lady Maroons in straight sets, 25-21, 25-12, 26-24. #UAAPSason81Volleyball",10,1,#UAAPSason81Volleyball
0,2019-04-10 05:37:02+00:00,gmanews_sports,,"Thank you, Dwyane! #OneLastDancehttps://twitter.com/MiamiHEAT/status/1115808945837359105 …",4,0,#OneLastDancehttps
0,2019-04-10 04:44:43+00:00,gmanews_sports,,"Thank you, Dirk!https://twitter.com/NBA/status/1115822219932909569 …",2,1,
0,2019-04-09 16:08:29+00:00,gmanews_sports,,"Michael Jordan: 6x NBA champ 6x NBA Finals MVP 5x NBA MVP 2x Olympic Gold medalist Hall of Fame inductee Is he the G.O.A.T.? According to a survey answered by some NBA players, yes, he is. LeBron comes in at 2nd, while Kobe is at 3rd. Do you agree? http://bit.ly/2G4qR9n pic.twitter.com/2CgCkYnPOY",7,1,
0,2019-04-09 09:29:09+00:00,gmanews_sports,,"For NBA stars, Michael Jordan is still the G.O.A.T., not LeBron James. Do you agree?http://bit.ly/2G4qR9n",11,0,
0,2019-04-09 03:56:04+00:00,gmanews_sports,,It’s the 44th anniversary of the PBA!https://twitter.com/pbaconnect/status/1115428195690401792 …,6,1,
0,2019-04-09 03:55:10+00:00,gmanews_sports,,"Congratulations, Virginia!https://twitter.com/marchmadness/status/1115462581458595841 …",3,1,
0,2019-04-08 13:32:11+00:00,gmanews_sports,,"TNT equalizes, forces rubber match against SMB, 93-88. #PBA2019 (Photos: PBA Media Group)pic.twitter.com/IdEi86ZZfn",28,4,#PBA2019
0,2019-04-08 10:32:10+00:00,gmanews_sports,,"Magnolia wins, 106-77, forces do-or-die against Barangay Ginebra #PBA2019. (Photos: PBA Media Group)pic.twitter.com/fYeni7Qfaz",80,15,#PBA2019
0,2019-04-08 03:38:56+00:00,gmanews_sports,,"#UAAPSeason81Volleyball (Women’s) Team rankings, player ranking by skills as of April 7, 2019pic.twitter.com/eTb5MhLWTK",7,3,#UAAPSeason81Volleyball
0,2019-04-07 13:07:08+00:00,gmanews_sports,,"Phoenix advance to their first semis! The Fuelmasters rout Alaska, 91-76. (Photos: PBA Media Group) #PBA2019pic.twitter.com/nRrBrq9D5p",38,9,#PBA2019pic
0,2019-04-07 10:35:02+00:00,gmanews_sports,,"Rain or Shine Elastopainters clinch semis berth after winning over NorthPort, 91-85. #PBA2019 (Photos: PBA Media Group)pic.twitter.com/QTLtpc5tuE",22,2,#PBA2019
0,2019-04-07 09:52:36+00:00,gmanews_sports,,"With the win, Ateneo is now assured of a spot in the Final Four.",22,4,
0,2019-04-07 09:46:00+00:00,gmanews_sports,,"Ateneo Lady Eagles defeat NU Lady Bulldogs in four sets, 25-14, 24-26, 25-17, 25-19. #UAAPSeason81Volleyball",32,6,#UAAPSeason81Volleyball
0,2019-04-07 07:24:26+00:00,gmanews_sports,,"DLSU Lady Spikers sweep Adamson Lady Falcons, 25-15, 25-18, 25-16. #UAAPSeason81Volleyball",49,3,#UAAPSeason81Volleyball
0,2019-04-07 05:44:32+00:00,gmanews_sports,,"Player rankings by skills as of April 6, 2019 #UAAPSeason81Volleyballpic.twitter.com/iLr17sXqF7",7,1,#UAAPSeason81Volleyballpic
0,2019-04-07 05:44:28+00:00,gmanews_sports,,"Before the games this afternoon, here are the team rankings as of April 6, 2019 #UAAPSeason81Volleyballpic.twitter.com/7SEwmKBsvJ",5,0,#UAAPSeason81Volleyballpic
0,2019-04-06 13:08:25+00:00,gmanews_sports,,"Earlier: San Miguel Beermen take Game 1 of best-of-3 QFs against TNT, 80-78. (Photos: PBA Media Group)pic.twitter.com/9Ux4q1Ne8R",11,4,
0,2019-04-06 13:02:31+00:00,gmanews_sports,,"Barangay Ginebra draws first blood against Magnolia Hotshots in the #PBA2019 quarterfinals, 86-75. (Photos: PBA Media Group)pic.twitter.com/17xF7X0iUC",60,17,#PBA2019
0,2019-04-06 10:20:19+00:00,gmanews_sports,,"FEU Lady Tamaraws score a crucial win against UP Lady Maroons, 25-21, 19-25, 25-23, 25-22, to gain a share of third place. Both FEU and UST tied at 7-4; UP falls to 6-5 for fourth place. #UAAPSeason81Volleyball via @tj_roxas",38,7,#UAAPSeason81Volleyball
0,2019-04-05 13:41:45+00:00,gmanews_sports,,Schedule of the #PBA2019 Philippine Cup quarters which will start tomorrow!https://twitter.com/pbaconnect/status/1114158957784731649 …,0,0,#PBA2019
0,2019-04-05 13:01:38+00:00,gmanews_sports,,"Alaska Aces defeat NLEX Road Warriors, advance to #PBA2019 Philippine Cup quarterfinals, 88-80. (Photos: PBA Media Group)pic.twitter.com/sdKBXJRDJd",9,2,#PBA2019
0,2019-04-04 18:15:32+00:00,gmanews_sports,,NBA Playoffs update:https://twitter.com/nbastats/status/1113826205197901834 …,5,1,
0,2019-04-04 05:23:07+00:00,gmanews_sports,,"Nikola Jokic had 20 points, 11 rebounds and nine assists, Jamal Murray finished with 14 points, 11 assists and six rebounds, and the host Denver Nuggets beat the San Antonio Spurs 113-85 on Wednesday night.http://bit.ly/2YLVZ5M",0,1,
0,2019-04-04 04:37:41+00:00,gmanews_sports,,https://twitter.com/philfootball/status/1113627586679066624 …,4,1,
0,2019-04-03 15:57:12+00:00,gmanews_sports,,"""You know, we move on... I don't just box inside the ring...I had a fun time when I was fighting, a great time, but you know I'm busy with so many other things. I'm a chameleon. I wish Manny nothing but the best.""https://bit.ly/2HWuj9q",6,1,
0,2019-04-03 15:50:11+00:00,gmanews_sports,,"Earlier: Ateneo Lady Eagles still hold the top spot of the standings with a 9-1 record, after winning over FEU Lady Tamaraws in straight sets, 25-21, 25-10, 25-18.pic.twitter.com/9Eih6xntE1",4,2,
